20190522144403381,http://kenh14.vn//soc-voi-canh-tuong-con-sot-lai-sau-khi-nguoi-dan-san-do-giam-gia-50-nhan-dip-chuoi-sieu-thi-auchan-cua-phap-roi-khoi-viet-nam-20190522144403381.chn,Sốc với cảnh tượng còn sót lại sau khi người dân săn đồ giảm giá nhân dịp chuỗi siêu thị Auchan rời Việt Nam,2019-05-22T15:18:00,"Sau khi ra thông báo ngừng hoạt động, chuỗi siêu thị Auchan bắt đầu chương trình xả hàng với mức giảm giá hấp dẫn. Để có được món hàng giá hời, rất đông khách hàng đã ồ ạt kéo tới, tạo nên cảnh tượng đông đúc, hỗn loạn tại một số siêu thị.","Ngày 20/05, hệ thống siêu thị Auchan đã ra thông báo sẽ đóng cửa hàng loạt siêu thị tại Việt Nam. Theo đó, từ ngày 03/06, 15 siêu thị thuộc chuỗi bán lẻ này sẽ ngừng hoạt động, hệ thống sẽ chỉ giữ lại 3 siêu thị ở TP HCM (2 ở Quận 7, 1 ở quận Tân Bình). Nguyên nhân là do mảng kinh doanh này vẫn đang thua lỗ.Thông báo ""chào tạm biệt"" của Auchan (Ảnh: Hoàng Linh).Trong thời gian trước khi ngừng hoạt động, hệ thống 15 siêu thị của Auchan bắt đầu chương trình xả hàng, mua 1 tặng một hoặc giảm giá 25-30% toàn bộ hàng hóa. Sự kiện này lập tức thu hút rất đông khách hàng kéo tới nhằm săn hàng giá rẻ, tạo nên cảnh tượng đông đúc nhốn nháo tại một số siêu thị.Trưa 22/05, trên MXH xuất hiện một số hình ảnh được ghi nhận tại siêu thị Auchan ở TP Tây Ninh, tỉnh Tây Ninh cho thấy không khí thậm chí đã trở lên hỗn loạn bởi đám đông khách hàng chen lấn, xô đẩy cùng hàng loạt những hành động thiếu văn minh khác.Một số khách hàng thiếu ý thức khiến khu vực quầy hàng bừa bộn, hàng hóa bị vứt khắp mọi nơi (Ảnh: Cao Lĩnh).Nhiều người còn uống luôn chai nước khi chưa thanh toán, gặm táo rồi vứt lại trên giá hàng hay để cho con chơi với hàng hóa (Ảnh: Cao Lĩnh).Bạn Cao Lĩnh, chủ nhân những hình ảnh nói trên chia sẻ thêm: Cùng ngày, cảnh tượng đông đúc cũng được cho là tình trạng chung tại Auchan Trường Sơn (Quận 10, TP.HCM). Để có thể gom được thật nhiều hàng giá hời, một số khách hàng còn xé thùng mì tôm, đồ gói mì ra để lấy thùng các-tông đựng hàng.Cư dân mạng bức xúc với hành vi thiếu ý thức của một số khách hàng.Trong khi đó, tại siêu thị Auchan Kim Văn Kim Lũ (Hoàng Mai, Hà Nội), khi có thông báo siêu thị đóng cửa, nhiều người dân đã xếp hàng từ 7h sáng nay (22/5) để chờ mua hàng giảm giá.Quầy thanh toán tại đây luôn trong tình trạng quá tải (Ảnh: Hoàng Linh).Theo chia sẻ từ cư dân mạng, tình trạng hỗn loạn cũng xảy ở hầu hết các siêu thị Auchan còn lại khiến nhiều người bức xúc.., bạn K. P. bình luận., bạn A. Y. bình luận.Hệ thống Auchan Việt Nam trực thuộc tập đoàn bán lẻ Auchan hàng đầu tại Pháp. Tập đoàn Auchan đã có mặt tại hơn 16 quốc gia trên toàn thế giới.Trên trang Facebook của mình, Auchan tự giới thiệu siêu thị này phục vụ khách hàng với hơn 20.000 mặt hàng. Đặc biệt, có đến 80% sản phẩm xuất xứ Việt Nam thuộc 5 ngành hàng thực phẩm tươi sống, thực phẩm công nghệ, hóa mỹ phẩm, đồ dùng, may mặc và nhiều ngành hàng khác.Cho tới khi thông báo đóng cửa, Auchan vào Việt Nam được 4 năm, tính đến nay, chuỗi này có 1.000 nhân viên và 10 tỷ lượt khách mua hàng tại Việt Nam. Trước Auchan, thị trường bán lẻ tại Việt Nam thời gian qua cũng đã chứng kiến rất nhiều doanh nghiệp rút lui như Shop&Go bán lại cho Vingroup, Jardine Matheson Group cũng đóng cửa siêu thị Giant."
20190522164156912,http://kenh14.vn//nhan-vien-resort-ke-ve-loi-song-ky-quac-cua-nhom-nghi-can-giet-nguoi-roi-do-be-tong-20190522164156912.chn,Nhân viên resort kể về lối sống kỳ quặc của nhóm nghi can giết người rồi đổ bê tông,2019-05-22T17:00:00,"Trong thời gian thuê căn villa tại đây, nhóm người là nghi can trong vụ thi thể bị đổ bê tông ở Bình Dương không cho nhân viên dọn dẹp phòng.","Ngày 22-5, Cơ quan điều tra Công an huyện Xuyên Mộc (tỉnh Bà Rịa-Vũng Tàu) đã tới một khu resort tại xã Bình Châu, huyện Xuyên Mộc để xác minh các đối tượng liên quan đến vụ 2 thi thể bị đổ bê tông tại huyện Bàu Bàng (tỉnh Bình Dương) có khai báo việc đến khu du lịch này để lưu trú trong thời gian xảy ra vụ án. Đây là nơi được cho rằng nạn nhân Trần Đức Linh (50 tuổi, ngụ Nghệ An) rơi từ lầu 1 xuống đất tử vong.Quá trình xác minh, nhân viên phụ trách việc rà soát sổ theo dõi lưu trú của cơ sở xác nhận có một người xưng tên Hiệp đặt phòng qua điện thoại.Quá trình đăng ký căn villa thể hiện có Lê Ngọc Phương Thảo (SN 1990) có lưu trú 3 lần. Lần đầu, từ ngày 27-12-2018 đến 1-1-2019. Lần 2, từ ngày 15-1 đến 20-1-2019. Lần 3 từ ngày 21-1-2019 đến 23-1-2019. Tất cả các ngày lưu trú nhóm người trên đều ở tại căn V5.Theo nhân viên ở đây thì căn V5 có thể ở được 8 người. Cơ sở không thể quản lý được hết khách vì cổng khu biệt thự luôn mở và khách có thể vào ở chung. Khách thuê căn V5 đi xe ôtô màu bạc biển số 51A-718.30.Căn villa mà nhóm nghi can thuê trong một khu du lịch ở Bà Rịa-Vũng TàuTrong thời gian lưu trú, nhóm người này yêu cầu nhân viên không được dọn dẹp mà để tự khách dọn. Khi muốn thay ga trải giường thì nhân viên chỉ để ở bên ngoài cửa không được vào phòng. Chỉ có một người nếu cần giao dịch thì liên hệ đó là người phụ nữ dáng người ốm, mặc áo lam của nhà chùa.Nhân viên bảo vệ khu resort cũng cho hay mỗi ngày ở đây có rất nhiều khách ra vào, bảo vệ chỉ kiểm tra tài sản trong villa khi khách trả tiền ra về. ""Đoàn khách này khi vào thuê căn V5 thì có 5 người. Trong thời gian lưu trú ở đây có thuê xe máy của một nhân viên bảo vệ để đi ra ngoài mua thức ăn và lần cuối cùng là trả phòng vào lúc 5 giờ sáng"" - một nhân viên bảo vệ nói.Đặc biệt, theo đại diện khu resort, nếu nghi can nói có người té từ trên lầu xuống tử vong là không có cơ sở bởi sàn nhà chỉ cao cách mặt đất 2,4 m. ""Villa xây theo kiểu thái nên sàn trên tầng rất thấp"" - đại diện khu resort.Cùng ngày, Cơ quan CSĐT Công an tỉnh Bình Dương, cho biết qua điều tra nhóm nghi can giết người gồm Phạm Thị Thiên Hà (31 tuổi), Trịnh Thị Hồng Hoa (66 tuổi, cùng ngụ quận Tân Phú, TP Hồ Chí Minh), Lê Ngọc Phương Thảo (29 tuổi, ngụ Tiền Giang), Nguyễn Ngọc Tâm Huyên (40 tuổi, ngụ quận Gò Vấp, TP HCM).Liên quan đến vụ án này, do yêu cầu điều tra nên đến thời điểm này, Công an tỉnh Bình Dương mới tiết lộ danh tính thật của nghi can thứ 4 là Nguyễn Ngọc Tâm Huyên (không phải Lê Phú Hạnh, 54 tuổi, ngụ TP Thủ Dầu Một, Bình Dương như trước đây)."
20190522114839272,http://kenh14.vn//trung-quoc-phat-hien-co-so-lam-gia-hon-7000-lo-kem-chong-nang-anessa-nhieu-shop-viet-nam-ban-chi-bang-1-10-gia-goc-20190522114839272.chn,"Trung Quốc phát hiện cơ sở làm giả hơn 7.000 lọ kem chống nắng Anessa, nhiều shop Việt Nam bán chỉ bằng 1/10 giá gốc",2019-05-22T14:40:00,Cơ sở sản xuất kem chống nắng giả vừa bị cảnh sát Trung Quốc triệt phá gây xôn xao dư luận.,"Mùa hè đến cũng là lúc các chị em thi nhau dùng kem chống nắng để bảo vệ da. Tuy nhiên trên thị trường hiện nay, nhiều loại kem chống nắng đang bị làm giả tinh vi. Mới đây nhất, cảnh sát tỉnh Quảng Châu (Trung Quốc) vừa phát hiện một cơ sở chuyên sản xuất kem chống nắng giả với thành phẩm không khác gì hàng xịn mà người thường sẽ khó phân biệt.Được biết vào chiều ngày 17/4, cảnh sát Quảng Châu đã triệt phá cơ sở chuyên sản xuất kem chống nắng Anessa giả tại khu công nghiệp Xia Mao, quận Baiyun. Cảnh sát đã bắt giữ 9 nghi phạm và thu giữ một số lượng lớn nguyên liệu giả. Bề ngoài đây là một phân xưởng sản xuất hình thường đã được đăng ký giấy phép kinh doanh giả.Cơ sở sản xuất kem chống nắng giả vừa bị cảnh sát phát hiệnMôi trường làm việc sơ sài, tạm bợ, không có biện pháp đảm bảo vệ sinh. Theo quy trình, ban đầu từ chai nhựa trắng, công nhân sẽ đổ hỗn hợp sữa chống nắng giả, cho thêm viên bi. Sau đó đóng nắp chai, dùng máy in phun thông tin lên thân chai, và đóng gói chai vào túi. Theo ước tính chỉ mất khoảng 6 tệ (20.000VNĐ) để sản xuất lọ kem chống nắng được bán với giá từ 400.000 - 500.000 VNĐ.Tình trạng làm việc thiếu vệ sinhChai kem chống nắng giả thành phẩm được đánh giá là không khác gì hàng thật, rất khó phân biệt. Kem không có khả năng chống nắng và có thể khiến da bị kích ứng. Tại hiện trường, cảnh sát đã thu giữ 7.350 sản phẩm thành phẩm, 4.800 chai rỗng và một số vật liệu liên quan. Giá trị liên quan ước tính khoảng hơn 2 triệu NDT ~ 7 tỷ đồng.Thành quả kem chống nắng giả được đánh giá là tinh xảo không kém gì hàng thậtTrên thực tế, không chỉ ở Trung Quốc, tại Việt Nam kem chống nắng Anessa cũng được bày bán rất nhiều và phổ biến. Dạo một vòng quanh các trang mạng xã hội hay các trang mua sắm trực tuyến bạn có thể thấy nhiều người rao bán loại kem chống nắng này với mức giá vô cùng rẻ mặt, thậm chí chỉ bằng 1/5 đến 1/10 so với giá chính hãng.Loại kem chống nắng này có giá chính hãng là 625.000 VNĐ cho chai 60ml, nhưng được nhiều người bán với mức giá rẻ hơn nhiều lầnThậm chí còn có cả giá sỉ chỉ bằng một nửa giá gốcNguồn: Sina, Iqiyi"
20190522160450303,http://kenh14.vn//hoac-kien-hoa-phat-hien-lam-tam-nhu-tung-co-1-doi-chong-dung-dung-noi-gian-doi-ly-hon-20190522160450303.chn,"Hoắc Kiến Hoa phát hiện Lâm Tâm Như từng có 1 đời chồng, đùng đùng nổi giận đòi ly hôn?",2019-05-22T16:50:30,Trang QQ đã đưa ra lời khẳng định thông tin liên quan đến Hoắc Kiến Hoa và Lâm Tâm Như.,"Trang QQ đưa tin, cách đây không lâu, truyền thông Hong Kong bất ngờ tiết lộ thông tin gây sốc:  phát hiện  từng có 1 đời chồng trước khi cưới anh. Không thể chấp nhận sự thật này, nam diễn viên đùng đùng nổi giận, quyết định ly hôn với vợ.Nguồn tin cho biết thêm, Lâm Tâm Như thực chất cưới Hoắc Kiến Hoa là ""thêm 1 lần đò"". Trước khi hẹn hò với Hoắc Kiến Hoa, nữ diễn viên đã có một cuộc hôn nhân kéo dài trong 1 thời gian ngắn. Chồng cũ của Lâm Tâm Như là một đại gia ngoài làng giải trí. Vì không thể chịu nổi cuộc sống bận rộn của vợ, hai người ""gần ít xa nhiều"", cũng không thể chịu nổi Lâm Tâm Như đóng cảnh giường chiếu, ôm hôn người khác, chính vì vậy vị đại gia quyết định ly hôn.Chính vì lý do đó, trong cuộc hôn nhân thứ 2, Lâm Tâm Như quyết định chọn nghệ sĩ trong giới giải trí như Hoắc Kiến Hoa làm chồng, hy vọng cả hai có thể cùng nhau chung sống hạnh phúc. Không thể ngờ rằng, Hoắc Kiến Hoa biết chuyện Lâm Tâm Như từng kết hôn liền cảm thấy vô cùng tức giận. Anh cảm thấy Lâm Tâm Như lừa dối chính mình, sau đó quyết định ly hôn.Thông tin này khiến netizen xứ Trung xôn xao bàn tán, bởi vụ việc quá sức đột ngột, cũng như trong giới chưa bao giờ nghe tới việc Lâm Tâm Như từng kết hôn.Tuy vậy, trang QQ lại đưa ra nhận định, đây thực chất chỉ là tin đồn trong giới. Hoắc Kiến Hoa và Lâm Tâm Như vẫn là 1 trong những cặp đôi ngọt ngào nhất nhì làng giải trí. Nam tài tử gần đây bị chê bai phát tướng như ông chú trung niên song Lâm Tâm Như cũng đã đứng ra bảo vệ chồng và cho biết ông xã béo lên là để phù hợp với vai diễn mới trong phim, chứng minh tình cảm ngọt ngào của cả hai. QQ khẳng định thêm, thông tin ""Lâm Tâm Như đã ly hôn một đời chồng"" chỉ là tin đồn ác ý, mong rằng netizen không tuyên truyền, chia sẻ nhiều trên MXH.Nguồn: QQ"
20190522180114616,http://kenh14.vn//lai-tha-rong-dao-pho-nhung-sao-lan-nay-sulli-duoc-khen-ngoi-het-loi-the-nay-20190522180114616.chn,"Lại thả rông dạo phố, sao lần này Sulli vừa được khen hết lời vừa leo lên top trend thế này?",2019-05-22T18:01:17,"Hình ảnh mới của Sulli khiến người hâm mộ phải bật lên lời khen: ""Sao mà xinh thế này?"".","Nhan sắc của Sulli khiến fan nao lòng, lấn át cả vòng 1 thả rông của cô nàng(Hình ảnh đã được làm mờ)Khoảnh khắc Sulli dạo phố thôi mà gây sốt vì quá xinhThường xuyên ""thả rông"", Sulli bị chỉ trích không ít lần nhưng cô nàng vẫn tự do, thoải mái ăn mặc theo kiểu mình thích mà không cần để ý đến ý kiến của công chúngNguồn: Instagram, Naver"
20190522114249209,http://kenh14.vn//buc-hinh-nay-dang-gay-bao-mang-khi-cho-thay-bo-mat-dang-so-it-nguoi-biet-ve-loai-soc-hien-lanh-20190522114249209.chn,Bức hình này đang gây bão mạng khi cho thấy bộ mặt đáng sợ ít người biết về loài sóc hiền lành,2019-05-22T20:30:49,"Sóc nổi tiếng hiền lành, ai mà nghĩ chúng gặm cả đầu rắn như thế chứ? Và bật mí thêm cho bạn, cái xác rắn ấy còn bị ăn gần hết nữa cơ.","Nếu trông thấy trận chiến giữa một con sóc và một con rắn, bạn nghĩ bên nào sẽ thắng? Có lẽ, đa số sẽ chẳng ai đặt cược cho sóc cả. Tương quan chênh lệch đã quá rõ ràng khi rắn là loài săn mồi đáng sợ, còn sóc thì nổi tiếng hiền lành, chỉ ăn quả, hạt thôi.Nhưng có vẻ tất cả đã nhầm, ít nhất là theo như tấm hình đang được cư dân mạng chia sẻ dữ dội gần đây, về cảnh một con sóc đang cầm đầu rắn mà gặm như ăn kem.Được biết, tấm ảnh này được chụp vào năm 2009 bởi William Leggett - kiểm lâm Công viên quốc gia núi Guadalupe phía Tây Texas. Đừng nghĩ đây là một cảnh được dàn dựng, bởi Leggett có chụp thêm vài tấm về những gì diễn ra kế tiếp. Con sóc sau đó đã ăn gần như toàn bộ cái xác rắn nó có được.Dù đã được chụp khá lâu, mới đây Cục công viên quốc gia Hoa Kỳ (NPS) đã cho đăng lại tấm hình lên mạng xã hội, và nhanh chóng nhận được sự quan tâm của cộng đồng mạng. Theo như lời dẫn từ bài đăng, con sóc chỉ để lại độ 5cm thân rắn mà thôi.Có thể nhiều người sẽ cảm thấy lạ, nhưng với giới khoa học thì đây là hiện tượng hết sức bình thường. Thực tế đúng là sóc không hề hiền lành như chúng ta tưởng.- Leggett chia sẻ với HuffPost.Ngoài ra, mối quan hệ giữa sóc và rắn cũng ""dây mơ rễ má"" nhiều hơn chúng ta tưởng. Thậm chí, có cả một video về cảnh sóc và rắn đánh nhau, với phần thắng nghiêng về phía kẻ yếu nữa kia.Trận chiến cho thấy loài sóc có thể không hiền như bạn tưởng
"
20190522181122569,http://kenh14.vn//song-gio-tiep-tuc-cang-thang-angela-baby-huynh-hieu-minh-bat-dau-phan-chia-tai-san-sau-ly-hon-20190522181122569.chn,"Sóng gió tiếp tục căng thẳng, Angela Baby - Huỳnh Hiểu Minh bắt đầu phân chia tài sản sau ly hôn?",2019-05-22T20:34:56,Nhiều netizen cảm thấy hoang mang trước những thông tin trái chiều về cặp đôi Angela Baby - Huỳnh Hiểu Minh.,"Những ngày qua, netizen xứ Trung cảm thấy được củng cố niềm tin về cuộc hôn nhân của  và . Baby đã dành nhiều lời khen ẩn ý dành cho ông xã họ Huỳnh trong các chương trình truyền hình, sự kiện tuyên truyền.Vậy nhưng, ngày hôm nay, 1 blogger bất ngờ chia sẻ thông tin cặp vợ chồng quyền lực bắt đầu phân chia tài sản và tìm luật sư. Xuất thân là 1 người mẫu trong giới giải trí, mọi thành tựu hiện tại của Angela Baby đều ""dính"" liền với Huỳnh Hiểu Minh. Vậy nhưng hiện tại trong làng giải trí, Angela Baby đang thắng thế trước ông xã vì rất nhiều người bạn tốt của Huỳnh Hiểu Minh đều đứng về phía cô.Nguồn tin râm ran gây hoang mang trong giới ngày hôm nayThông tin này vẫn khiến nhiều người nghi ngờ, bởi Trác Vỹ từng phủ nhận chuyện hai vợ chồng gặp trục trặc tình cảm. Trước đó có tin đồn cho hay, Huỳnh Hiểu Minh ngoại tình với Cổ Lực Na Trát, còn Angela Baby có ""gian tình"" với Đặng Luân. Thời điểm scandal ngoại tình của Trương Đan Phong và trợ lý Tất Huỳnh nổ ra, nguồn tin trong giới râm ran rằng, thực chất Angela Baby đã chi 1 khoản tiền lớn để ""bịt miệng"" Trác Vỹ, thay thế tin của Baby bằng tin của Đặng Luân, bởi trước đó Trác Vỹ định khui 2 vợ chồng quyền lực này.Angela Baby được cho là có gian tình với Đặng LuânKhông lẽ chỉ sau 4 năm làm đám cưới, cặp đôi chính thức đường ai nấy đi?Nguồn: QQ"
